{
    "$schema": "http://json-schema.org/draft-07/schema#",
    "$id": "https://raw.githubusercontent.com/dedis/popstellar/master/protocol/query/method/rumor_state.json",
    "description": "Match sharing state of last rumor seen per sender",
    "type": "object",
    "additionalProperties": false,
    "properties": {
        "method": {
            "description": "[String] operation to be performed by the query",
            "const": "rumor_state"
        },

        "params": {
            "type": "object",
            "additionalProperties": false,
            "properties": {
                "rumor_state": {
                    "$ref": "object/rumor_state.json"
                }
            },
            "required": ["rumor_state"]
        },

        "jsonrpc": {
            "$comment": "Defined by the parent, but needed here for the validation"
        },

        "id": {
            "type": "integer"
        }
    },

    "required": ["method", "params", "id", "jsonrpc"]
}
