{
    "jsonrpc": "2.0",
    "id": 4,
    "method": "rumor_state",
    "params": {
        "rumor_state": {
            "J9fBzJV70Jk5c-i3277Uq4CmeL4t53WDfUghaK0HpeM=": 3,
            "RZOPi59Iy5gkpS2mkpfQJNl44HKc2jVbF0iTGm0RvfU=": 5,
            "CfG2ByLhtLJH--T2BL9hZ6eGm11tpkE-5KuvysSCY0I=": 1,
            "r8cG9HyJ1FGBke_5IblCdH19mvy39MvLFSArVmY3FpY=": 10
        }
    }
}
